{
  "$schema": "https://echo-ui-automation/schemas/contracts/journey/v1",
  "journeyId": "awakening-settings-no-permissions",
  "steps": [
    {
      "surfaceId": "awakening-settings",
      "stateId": "empty-permissions",
      "actionId": "awakening.toggleAnniversary"
    },
    {
      "surfaceId": "awakening-settings",
      "stateId": "empty-permissions",
      "actionId": "awakening.toggleGeofence"
    },
    {
      "surfaceId": "awakening-settings",
      "stateId": "loaded",
      "actionId": "awakening.requestBackgroundLocation"
    },
    {
      "surfaceId": "awakening-settings",
      "stateId": "loaded",
      "actionId": "awakening.toggleEmotion"
    },
    {
      "surfaceId": "awakening-settings",
      "stateId": "loaded",
      "actionId": "awakening.requestNotification"
    }
  ],
  "preconditionFixtures": [
    "awakening-no-permissions"
  ],
  "assertions": [
    {
      "type": "launch_read_only",
      "expected": "opening surface issues zero authorization requests"
    },
    {
      "type": "request_scope",
      "expected": "anniversary none; geofence When In Use; background action Always; emotion HRV read; notification notification only"
    },
    {
      "type": "request_order",
      "expected": "one explicit action per system prompt"
    },
    {
      "type": "health_state",
      "expected": "requestCompleted/noReadableSamples is valid and uses fallback"
    }
  ],
  "version": "1.1.0"
}
