{
  "$schema": "https://echo-ui-automation/schemas/contracts/journey/v1",
  "journeyId": "creation-generate-save-basic",
  "steps": [
    { "surfaceId": "creation", "stateId": "idle", "actionId": "creation.selectTemplate" },
    { "surfaceId": "creation", "stateId": "idle", "actionId": "creation.generate" },
    { "surfaceId": "creation", "stateId": "generating", "actionId": "creation.generate" },
    { "surfaceId": "creation", "stateId": "generated", "actionId": "creation.copy" },
    { "surfaceId": "creation", "stateId": "generated", "actionId": "creation.saveToNotes" }
  ],
  "preconditionFixtures": ["creation-generated-letter"],
  "assertions": [
    { "type": "generate_flow", "expected": "idle -> generating -> generated with citation anchors" },
    { "type": "copy", "expected": "Content copied to pasteboard" },
    { "type": "save_to_notes", "expected": "Local export prepares and presents the system share sheet; cancellation is not an error; no saved-note Toast or link is asserted (ADR-013)" }
  ],
  "version": "1.1.0"
}
