{
  "$schema": "https://echo-ui-automation/schemas/contracts/journey/v1",
  "journeyId": "awakening-settings-basic",
  "steps": [
    { "surfaceId": "awakening-settings", "stateId": "loaded", "actionId": "awakening.toggleGeofence" },
    { "surfaceId": "awakening-settings", "stateId": "loaded", "actionId": "awakening.toggleEmotion" },
    { "surfaceId": "awakening-settings", "stateId": "loaded", "actionId": "awakening.toggleAnniversary" },
    { "surfaceId": "awakening-settings", "stateId": "loaded", "actionId": "awakening.showGeofenceDetail" },
    { "surfaceId": "awakening-settings", "stateId": "loaded", "actionId": "awakening.dismissGeofenceDetail" }
  ],
  "preconditionFixtures": ["awakening-loaded"],
  "assertions": [
    { "type": "permission_state", "expected": "all granted" },
    { "type": "toggle_state", "expected": "all three toggles flip" },
    { "type": "geofence_detail", "expected": "detail sheet opens and dismisses" }
  ],
  "version": "1.0.0"
}
